{
  "palette": {
    "ink": "#111111"
  },
  "roles": {
    "default": {
      "font_family": "default",
      "font_size": 12000,
      "line_height_mult": 1200,
      "color": "ink"
    },
    "document": {
      "font_family": "default",
      "font_size": 12000,
      "line_height_mult": 1200,
      "color": "ink"
    },
    "cell": {
      "font_family": "default",
      "font_size": 12000,
      "line_height_mult": 1200,
      "color": "ink"
    }
  },
  "modifiers": {
    "precedence": [],
    "styles": {}
  },
  "font_aliases": {}
}
