{"modifiers":{"precedence":["emphasis","link","underline","strikethrough"],"styles":{"emphasis":{"code":{"color":"muted"},"emphasis":{"italic":true},"strong":{"bold":true}},"link":{"default":{"color":"accent","underline":true}}}},"palette":{"accent":"#0F766E","alt_row":"#F0FDFA","disabled":"#1B2A4A61","header_bg":"#0F766E","header_ink":"#FFFFFF","ink":"#1B2A4A","muted":"#4A5B76","paper":"#FFFFFF","rule":"#CBD5E1","signature":"#F8FAFC","warning_bg":"#FEF3C7","warning_ink":"#92400E"},"primitives":{"blurs":{"background":{"radius_pt":20000}},"borders":{"contrast":{"color":"#1B2A4A4D","width_pt":1000},"subtle":{"color":"#1B2A4A1A","width_pt":500},"subtle_bottom":{"color":"#1B2A4A1A","width_pt":500,"edges":["bottom"]}},"corners":{"full":9999000,"large":24000,"medium":12000,"none":0,"small":4000},"shadows":{"elevation.1":{"layers":[{"blur_radius_pt":4000,"color":"#0000001A","offset_x_pt":0,"offset_y_pt":2000,"spread_radius_pt":0},{"blur_radius_pt":1000,"color":"#00000014","offset_x_pt":0,"offset_y_pt":1000,"spread_radius_pt":0}]},"elevation.2":{"layers":[{"blur_radius_pt":12000,"color":"#00000026","offset_x_pt":0,"offset_y_pt":4000,"spread_radius_pt":0},{"blur_radius_pt":2000,"color":"#0000001A","offset_x_pt":0,"offset_y_pt":2000,"spread_radius_pt":0}]},"elevation.3":{"layers":[{"blur_radius_pt":24000,"color":"#00000033","offset_x_pt":0,"offset_y_pt":8000,"spread_radius_pt":0},{"blur_radius_pt":4000,"color":"#00000026","offset_x_pt":0,"offset_y_pt":4000,"spread_radius_pt":0}]}},"surfaces":{"alt_row":{"color":"alt_row","type":"solid"},"glass_dark":{"color":"#00000099","type":"solid"},"glass_light":{"color":"#FFFFFFCC","type":"solid"},"header_bg":{"color":"header_bg","type":"solid"},"inverse":{"color":"ink","type":"solid"},"muted":{"color":"muted","type":"solid"},"paper":{"color":"paper","type":"solid"},"rule":{"color":"rule","type":"solid"},"signature":{"color":"signature","type":"solid"},"warning_bg":{"color":"warning_bg","type":"solid"}}},"roles":{"body":{"box_decoration":{"padding_pt":{"bottom":10000,"left":0,"right":0,"top":0}},"color":"ink","font_family":"NotoSansSC-Regular","font_size":12000,"line_height_mult":1600},"card":{"box_decoration":{"background":"paper","corner_radius":"medium","padding_pt":{"bottom":16000,"left":16000,"right":16000,"top":16000}},"color":"ink","font_family":"NotoSansSC-Regular","font_size":12000,"line_height_mult":1600,"variants":{"flat":{"box_decoration":{"background":"paper","corner_radius":"medium","padding_pt":{"bottom":16000,"left":16000,"right":16000,"top":16000}}},"glass":{"box_decoration":{"background":"glass_light","blur":"background","border":"subtle","corner_radius":"medium","padding_pt":{"bottom":16000,"left":16000,"right":16000,"top":16000}}},"raised":{"box_decoration":{"background":"paper","corner_radius":"medium","padding_pt":{"bottom":16000,"left":16000,"right":16000,"top":16000},"shadow":"elevation.1"}}}},"code":{"box_decoration":{"background":"signature","corner_radius":"small","padding_pt":{"bottom":8000,"left":8000,"right":8000,"top":8000}},"color":"ink","font_family":"NotoSansSC-Regular","font_size":10500,"line_height_mult":1400},"default":{"color":"ink","font_family":"NotoSansSC-Regular","font_size":12000,"line_height_mult":1600},"document":{"box_decoration":{"background":"paper"},"color":"ink","font_family":"NotoSansSC-Regular","font_size":12000,"line_height_mult":1600},"h1":{"bold":true,"box_decoration":{"padding_pt":{"bottom":10000,"left":0,"right":0,"top":0}},"color":"accent","font_family":"NotoSansSC-Regular","font_size":24000,"letter_spacing_pt":-500,"line_height_mult":1250},"h2":{"bold":true,"box_decoration":{"padding_pt":{"bottom":8000,"left":0,"right":0,"top":16000}},"color":"ink","font_family":"NotoSansSC-Regular","font_size":18000,"line_height_mult":1300},"h3":{"bold":true,"box_decoration":{"padding_pt":{"bottom":6000,"left":0,"right":0,"top":12000}},"color":"ink","font_family":"NotoSansSC-Regular","font_size":14000,"line_height_mult":1350},"h4":{"bold":true,"box_decoration":{"padding_pt":{"bottom":4000,"left":0,"right":0,"top":10000}},"color":"ink","font_family":"NotoSansSC-Regular","font_size":12000,"line_height_mult":1400},"list_item":{"color":"ink","font_family":"NotoSansSC-Regular","font_size":12000,"line_height_mult":1500,"list_style":{"bullet_glyph":"-","depth_indent_pt":18000,"marker_box_width_pt":18000,"marker_gap_pt":4000,"number_suffix":"."}},"math":{"box_decoration":{"padding_pt":{"bottom":8000,"left":0,"right":0,"top":8000}},"color":"ink","font_family":"NotoSansMath-Regular","font_size":12000,"line_height_mult":1600,"text_align":"center"},"quote":{"box_decoration":{"padding_pt":{"bottom":10000,"left":16000,"right":0,"top":0}},"color":"muted","font_family":"NotoSansSC-Regular","font_size":12000,"line_height_mult":1600},"rule":{"box_decoration":{"background":"rule"},"color":"muted","font_family":"NotoSansSC-Regular","font_size":2000,"line_height_mult":1000},"running_footer":{"color":"muted","font_family":"NotoSansSC-Regular","font_size":9000,"line_height_mult":1200},"running_header":{"color":"muted","font_family":"NotoSansSC-Regular","font_size":9000,"line_height_mult":1200},"section":{"color":"ink","font_family":"NotoSansSC-Regular","font_size":12000,"line_height_mult":1600},"signature_block":{"box_decoration":{"background":"signature","padding_pt":16000},"color":"muted","font_family":"NotoSansSC-Regular","font_size":12000,"line_height_mult":1400},"table":{"color":"ink","font_family":"NotoSansSC-Regular","font_size":11000,"line_height_mult":1400},"table_header_cell":{"box_decoration":{"background":"header_bg","corner_radius":"small","padding_pt":{"bottom":6000,"left":6000,"right":6000,"top":6000}},"color":"header_ink","font_family":"NotoSansSC-Regular","font_size":11000,"line_height_mult":1400},"table_row_cell":{"box_decoration":{"padding_pt":{"bottom":6000,"left":6000,"right":6000,"top":6000}},"color":"ink","font_family":"NotoSansSC-Regular","font_size":11000,"line_height_mult":1400,"variants":{"alt":{"box_decoration":{"background":"alt_row","padding_pt":{"bottom":6000,"left":6000,"right":6000,"top":6000}}}}},"warning":{"box_decoration":{"background":"warning_bg","corner_radius":"small","padding_pt":12000},"color":"warning_ink","font_family":"NotoSansSC-Regular","font_size":12000,"line_height_mult":1400},"form_field":{"font_family":"NotoSansSC-Regular","font_size":11000,"line_height_mult":1400,"color":"ink","box_decoration":{"padding_pt":{"top":2000,"right":4000,"bottom":2000,"left":4000},"border":"subtle_bottom"},"variants":{"underline":{"box_decoration":{"border":"subtle_bottom"}},"box":{"box_decoration":{"border":"subtle","corner_radius":"small"}},"checkbox":{"box_decoration":{"border":"contrast","corner_radius":"small"}}}}}}